{
  "$schema": "http://json-schema.org/draft-07/schema",
  "$id": "https://github.com/MobilityData/gbfs/blob/v3.0/gbfs.md#station_statusjson",
  "description":
    "Describes the capacity and rental availability of the station",
  "type": "object",
  "properties": {
    "last_updated": {
      "description":
        "Last time the data in the feed was updated in RFC3339 format.",
      "type": "string",
      "format": "date-time"
    },
    "ttl": {
      "description":
        "Number of seconds before the data in the feed will be updated again (0 if the data should always be refreshed).",
      "type": "integer",
      "minimum": 0
    },
    "version": {
      "description":
        "GBFS version number to which the feed conforms, according to the versioning framework (added in v1.1).",
      "type": "string",
      "const": "3.0"
    },
    "data": {
      "description":
        "Array that contains one object per station as defined below.",
      "type": "object",
      "properties": {
        "stations": {
          "type": "array",
          "items": {
            "type": "object",
            "properties": {
              "station_id": {
                "description": "Identifier of a station.",
                "type": "string"
              },
              "num_vehicles_available": {
                "description":
                  "Number of vehicles of any type physically available for rental at the station.",
                "type": "integer",
                "minimum": 0
              },
              "vehicle_types_available": {
                "description":
                  "Array of objects displaying the total number of each vehicle type at the station (added in v2.1-RC).",
                "type": "array",
                "items": {
                  "type": "object",
                  "properties": {
                    "vehicle_type_id": {
                      "description":
                        "The vehicle_type_id of vehicle at the station (added in v2.1-RC).",
                      "type": "string"
                    },
                    "count": {
                      "description":
                        "A number representing the total amount of this vehicle type at the station (added in v2.1-RC).",
                      "type": "integer",
                      "minimum": 0
                    }
                  },
                  "required": ["vehicle_type_id", "count"]
                }
              },
              "num_vehicles_disabled": {
                "description":
                  "Number of disabled vehicles of any type at the station.",
                "type": "integer",
                "minimum": 0
              },
              "num_docks_available": {
                "description":
                  "Number of functional docks physically at the station.",
                "type": "integer",
                "minimum": 0
              },
              "num_docks_disabled": {
                "description":
                  "Number of empty but disabled docks at the station.",
                "type": "integer",
                "minimum": 0
              },
              "is_installed": {
                "description": "Is the station currently on the street?",
                "type": "boolean"
              },
              "is_renting": {
                "description": "Is the station currently renting vehicles?",
                "type": "boolean"
              },
              "is_returning": {
                "description": "Is the station accepting vehicle returns?",
                "type": "boolean"
              },
              "last_reported": {
                "description":
                  "The last time this station reported its status to the operator's backend in RFC3339 format.",
                "type": "string",
                "format": "date-time"
              },
              "vehicle_docks_available": {
                "description":
                  "Object displaying available docks by vehicle type (added in v2.1-RC).",
                "type": "array",
                "items": {
                  "type": "object",
                  "properties": {
                    "vehicle_type_ids": {
                      "description":
                        "An array of strings where each string represents a vehicle_type_id that is able to use a particular type of dock at the station (added in v2.1-RC).",
                      "type": "array",
                      "items": {
                        "type": "string"
                      }
                    },
                    "count": {
                      "description":
                        "A number representing the total number of available docks for the defined vehicle type (added in v2.1-RC).",
                      "type": "integer",
                      "minimum": 0
                    }
                  },
                  "required": ["vehicle_type_ids", "count"]
                }
              }
            },
            "required": [
              "station_id",
              "num_vehicles_available",
              "is_installed",
              "is_renting",
              "is_returning",
              "last_reported"
            ]
          }
        }
      },
      "required": ["stations"]
    }
  },
  "required": ["last_updated", "ttl", "version", "data"]
}
